,review rating,review title,review content
123,5,Good Sound and Quality,"I have used Airpods in the past but since using these I will never go back. The sound quality is great, they have a gaming sound option. Best earphones."
124,1,Lagging,As soon as I received and pair up. Music cuts off. Too much lag. Any fixes?
125,5,No regrets,"For the price, the quality is much much better than I expected, it's well worth the price and I'd recommend anyone searching for a great experience with some wireless earbuds to try them out."
126,5,Theyâ€™re Amazing,"I personally use these for streaming on Twitch, the sound quality is insanely good and the fact they offer no delay helps whenever Iâ€™m playing any game thatâ€™s requiring split second reaction."
127,3,Decent for the price. Made for fanboys.,Fit is like a scaled up AirPod. The material is almost too â€œmatteâ€ finished and I find it sliding out of my ears often.
128,5,Amazing,"Sound quality is amazing. It could use a little more noise cancellation, but otherwise these are phenomenal. Keep up the good work!"
129,5,I love them.,Thank you so much guys.
130,5,Best option out there,Love these. My gf has the AirPods and I got these instead and I like them better. No issues whatsoever
131,5,AMAZING FOR THE PRICE!!,First pair of true wireless earbuds and I have to say wow these blow my mind after listening to them for a month now and they are the best out there and definitely worth the 100
132,4,GG Bois,It's good for gaming
133,5,Great,Love everything about them
134,5,AMAZING,I love the sound quality.  The battery life lasts me all day. And they cancel all the noise during school. Making me able to ignore people and teachers I don't like!
135,5,Noise cancelling is awesome!,"If your looking for an android style AirPods, than these are for you."
136,1,Don't Buy,"These work perfect if you're holding your phone in front of yourself at all times. The minute you put your phone in your pocket, expect connectivity issues."
137,5,Great for the price!,Great earpods for the price. The battery lasts a long time with the case. Sounds great and I am very happy with the purchase.
138,3,Good enough.,Casing is feels cheap and brittle. But sound quality and overall functionality is good.
139,5,"Great product Razer does not disappoint, perfect product if you want alternative to AirPods","Great product, Better then I expected.Connects instantly once paired.Love it Soo far.Great sound quality, won't turn it off"
140,2,So much better out there,"Battery life sucks, they are too big and hurt your ears, they cut in and out.I wouldn't recommend"
141,5,Awesome sound Quality,Awesome sound Quality but for people with small ears as me with the time using them it hurts
142,4,"Good product, but they don't really fit.","These are actually really good earphones. They work well, always have a good connection, good battery life. It's just they don't really for my ears. Now maybe I just have below average ear size and that's why they're so small but other than that they're actually really good."
143,3,Buy Elsewhere,"I was excited to get these earbuds because I had never had completely wireless earbuds before. These sounded fine, I did not need much more and the bass was good. However connectivity was laggy and bad. There are plenty of earbuds better than this and for less money."
144,5,Another good Razer product.,"While it doesn't have noise cancellation, they go loud enough that it doesn't matter. Sound better than airpods and the battery lasts long enough for me."
145,5,Great quality!,They fit really nice in my ear. I like how I can adjust the quality of sound whether it focuses on the treble or bass. I also like how theyâ€™re noise cancelling and just how long they last. I can have them in my ears for hours and the sound quality stays consistent.
146,2,Uncomfortable,"It just really hurts my ears, highly uncomfortable. I tried to ignore the pain the head phones being but it was just too much. Much more worth just buying a 25 dollar pair of gaming earbuds"
147,5,Best earbuds I have ever used,"I have been on the hunt for a good set of true wireless earbuds for a year, these fit every want I could have asked for. My wife is now considering letting go of her apple earbuds for a pair of these."
148,5,Good stuff,Works perfect I like it.
149,4,Battery only issueðŸ‘.,"Listen to music a lot on the daily. They fit good in my ear, sound was good. Only problem was battery life which was too short for my liking. Got about 3.5hrs per earbud. I would use one at a time to extend usage. Not that bad of a purchase."
150,2,Not to great,I am a huge racer fan and own a few of their products. Didnâ€™t sound that great and felt clunky and rushed. I switched to AirPods on android and they worked just as well if not better.
151,1,Uncomfortable not clear sound,It's not like an android earphone. But it's not bad if your into apple type style earphones. And it hurts the inside of my ears like they're uncomfortable to wear and feels like they are falling out even with the rubber piece.
152,5,Great buy,"I love all Razer products, I have a Mouse and Keyboard,Mouse Pad and a pair of Razer Kraken Headphones. I just needed wireless earphones so these are well made for something so small, definitely should get them"
153,4,Incomplete after-sales service,"It's easy to use, but it's also easy to lose. I lost a headset the first week I bought it. And neither the warranty nor razer officials could provide me with a way to buy my missing headphones."
154,4,Nice quality for cost!,"The audio quality was outstanding for the price, very good comfort fit, battery life is only about 3 hours before needing recharge. I believe the case hold about 17 hours in it."
155,5,It was a gift for someone else.,This was a gift for someone else.
156,3,Get different ear buds,They are not noise cancelling and they lag often
157,5,Good sound,Sounds good ðŸ‘
158,3,"Sounds great, but...",I love these ear buds. They connect so quick and sound amazing but they do not work very well with a mac book. If someone has some insight on this let me know but they do work great with phones.
159,5,Amazing,The sound quality and almost zero latency are amazing. Absolutely love these.
160,4,Wanted to love them,I really enjoyed these. The only problem I had is with apple product like designs they hurt my ears. Other than that I loved these headphones
161,5,Pretty good earbuds,"Over all I actually enjoy using these earbuds, I do think itâ€™s great for when I need alone time to my thoughts when in public"
162,5,A good purchase,Better to buy it on Amazon then on Razer's own site.
163,4,Great headset...mediocre battery life,Great earbud battery life not that great though.
164,5,Great quality - stay in ears and don't hurt ears to wear them,Works great!
165,5,Very impressive for the price,They sound good and work well and they donâ€™t block loud noses in the gym. But theyâ€™re great for the price and sounds quality
166,5,Must cop. Worth the Hundo,Floss Recommend these. Wasn't disappointed
167,5,Really good if what you care about is sound quality,"It is really good, the only problem is that the case is very cheap and scratches really easily."
168,3,Biggest than others,Really good sound and battery lifeBut those earphones aren't comfortableThey're not like apple earpods
169,5,Greatest earbuds I've tried.,Amazingly perfect earbuds! Was amazing enough for me to throw my airpods pro for it.
170,4,Good sound but uncomfortable,Not very comfortable for long periods of time.
171,4,Would buy again,"Amazing headphones, fit my ear and sound as good as AirPods"
172,5,Get these,ðŸ‘Œ
173,5,Worth it,Worth the price and love the size of the case. Fits in your pockets.
174,5,It's razer so be prepared,To me they worked perfectly don't know about you
175,5,No lag as using wired earphone,If you want to play game that's it
176,5,Love these,Works perfectly for PC gaming and listening to music at work.
177,1,Waste of time and money.,Most uncomfortable buds ever had.
178,5,Pretty good,"Pretty good, took a while for my ears to get used to the shape though."
179,5,Good product but needs improvement,Amazing sound quality but not enough battery life
180,5,nice,would buy again
181,5,Los mejores audÃ­fonos,Me encantaron!
182,4,Not bad,They are cool
183,5,None,Price is good
184,5,Good AirPod alt,Love razed.
185,5,Bangin,These slap
186,4,0ud 9gc,oggcig oh
187,5,tg,good
188,5,Amazing,Nice
189,5,Very good buds,"A very good set of buds.  I'll mention the style thing first because, hey, you're wearing these.  They have a bit of attitude to them which appeals to me, though they aren't in-your-face.  It's more subtle, and with the Razer logo they will be familiar to fellow gamers.However, looks are meaningless without performance, and these buds have it.  Pairing is ultra simple, and inputs (touch, etc) behave as expected.  Now true, they aren't as seamlessly integrated in iOS as AirPods would be, but then these aren't them.  :)  This said, there's not much that my AirPods do that these cannot, at least for 95% of what I use buds for.Sound quality is very very good.  Major thing here is to set expectations...I mean, these are ear buds.  They aren't going to rival big floor speakers.  Even at that, I was very impressed with the sound.  When playing Bioshock, I found performance to be, well, excellent.  Again, given the form factor.A slight point - the fit may NOT offer the best seal in the world against outside noise.  While the earbud sleeves help, they didn't give me a 100% seal.  Some of this may be my odd ear shape, but this said I found some aftermarket tips that work.In sum though - I think these are great.  Good sound for buds, design is great (they are a bit light in construction, but there's a line between weight and comfort that Razer has to straddle), and performance is significantly above par.  A very good set of buds."
190,5,Good bluetooth earphones,These have been my day drivers for headphones and haven't been disappointed since.
191,4,Fits in ear poorly,"I like the sound quality its great, but it falls out of my ear sometimes I used the earbuds mainly for gaming"
192,4,Stiff with no option to change ear piece,I donâ€™t like how they fit in the ear. They hurt my ear canal. There is no option to change it.
193,2,"Great look, horrible quality",The sound quality is terrible compared to other earbuds. Don't buy it unless you want it for its good look.
194,1,Hurts my ears,They hurt my ears really bad I had to return them because if it. Other than that they sound and work great.
195,4,Thumbs up from me,Overall pretty nice headphones the charging case feels a little cheap though
196,3,Big ears only,I did not like how the hammerheads did not have a good Seal and they are made for people with big ears
197,2,They are not very comfortable to use,the sound is not very good
198,5,Nice earpods,"Compact and easy to connect with iPhone, battery life will be checked after useI like it"
199,4,Great,Only thing is I cannot connect to a certain device.
200,4,"A nice pair of wireless earbuds, not enough to justify the price","First impression, good sounds, good battery life, they stay on your ears really well without being uncomfortable. The earbuds position in the case is odd (left bud on the right, right bud on the left), but it's less of a problem than I expected, actually isn't even a problem at all for me.It's not a sound canceling pair. It's made so that you can still hear things going on around you unless you're blasting music at the highest volume possible, probably risking your hearing in the future. Maybe a problem for many, not for me because I like to listen to music during work (I'm not supposed to but since this pair is really hidden and my hair is long, it's impossible to find them in my ears without lifting my hair up), the Hammerhead True Wireless is a bliss for me to do so and can still hear people when need to.The wrist strap is a nice addition that I can really appreciate, keep in mind that this thing is rather small. My hands aren't the biggest, more on the medium-small size for a guy, but the strap still struggles to get through and actually pushed back the strap holder thingy first time I put it on (it was not supposed to), and I had to glue the thing back.After a month of usage, I start to find problems with the pair. I dropped the buds a couple of times (they stay on really well but rather easy to take off if moved). Not sure if it's because of that, but the pair started to show more delays (both when playing games and doing general stuff like videos and music). Sounds lag happen more frequently; when listening to music, the song just stutters for 2-3 times before playing normally again; sometimes it starts on one bud before playing on both connected buds again.As good as this thing sounds, it's the same as many other Razer stuffs, they're weak in durability, making this pair not really worth $100 anymore."
201,4,quality for the price,"Simple to use and charge, nice sound and user friendly functions. They fit larger (my husbands) ears a bit better, but work fine in mine too. Compact charging/carrying case and the sound quality is good. There are simple to use functions while they're in use in your ears (like tapping the left here to switch songs, tapping the right ear to pause, etc.) See instruction manual for settings. Very happy with this product and way cheaper than apple ones."
202,1,"Cheap, Plastic Case","Please, do yourself a favor and don't buy these. When Razer announced these, I was happy since I used an Android device and finally seeing an Airpods variant really made me interested in the product and happy. After I bought it, as soon as I opened the case, I knew that the product was cheap and would break very quickly. The plastic feels lightweight and extremely flimsy. The hinge reminded me of those cheap Chromebooks that you can buy for around 100 dollars, so, nonexistent. After only 2 months of owning it, I realized that the hinge on the back started to form cracks leading to the bottom of the case. A little after that, the left earbud just stopped connecting altogether and is officially dead. I think that Razer was doing a good job in trying to release its own competition for Apple's Airpods, but don't buy these unless you plan to be disappointed."
203,3,Not Great for Multiplayer Gaming,"These earbuds are comfortable, they produce good sound, have low latency (fast without lag) and have a good battery life.  The downside is that when you use the mic, they switch from stereo mode to mono mode, (like being on a phone call).  When playing multiplayer games that require constant squad communication and direction sound (like COD), these seriously hamper you one way or another."
204,3,Uncomfortable but good sound,The earbuds are easy to connect and have good sound quality. It's really cool how when I pop out one out of my ear it pauses my music.  They dont lag with the computer.  I don't find the noise cancelling to be very effective but they are earbuds.  These are solid with no rubber comfort pieces.  I find them uncomfortable and have a hard time wearing them for longer periods of time.
205,4,Truly wireless gaming earbuds,"This is truly wireless gaming earbuds. if you're truly a gamer who looking for earbuds sets instead of full-sized headset and want wireless - this is the one for you.BUT, those earbuds got very poor battery when on gaming mode - 2 hours and a few little mins. I'm using this with my Msi gaming laptop and gaming very hard on them and it does serve its intended purpose.Another con to mention is that sadly there's no windows software UI for them so you don't know how many battery time you have left until the voices in the earbuds say that the battery is low...or if you want to change the EQ for your liking as u can do on the iOs platform.Another con, which is quite subjective, is the overall volume which for me was a quite in the ""ok this is not as loud as I would typically like""Overall this is a good product if you're truly gamer who want the best low latency earbuds and thats it's all about actually."
206,4,Really Kicks Out The Music,Iâ€™ve had more expensive buds that werenâ€™t as good sounding as these. Shows that quality doesnâ€™t always cost more. The sound is very good and the bass is equally well too. The slick case can be stored really anywhere. I donâ€™t know how to get the wristbands onto the bud holder. Doesnâ€™t say. It should of came connected already. Four Stars â­ï¸â­ï¸â­ï¸â­ï¸!!!
207,4,Good value for money,"These handsome, well made earbuds seem sturdier than their apple counterparts, harder to dislodge and more secure in the ear.  Sound quality is fine, but noise cancelling feature not as accurate.  I particularly like the recharge method."
208,5,"Buy these, not airpods!","These are amazing! Sound quality is amazing, especially during game play. I have always had issues with ear buds staying in my ears, but not with these. Battery life is great. I have went more than two days without charging. That is with off and on use. I would highly recommend these to anyone who likes quality."
209,1,Uncomfortable and cuts out,These are awful!! They are very uncomfortable. Sound quality is mediocre. We have razer phones and these still kept cutting out the whole time my husband had them on. His phone was in his pocket.
210,5,Great product,Nice product great sound and quality
211,4,Better than AirPods!,This has a amazing look to them and they have very good sound quality.
212,5,Awesome,Excellent. Perfect for gym and library study.
213,5,great earbud,the phone is very good and very good sound quality and the gaming mode helps a lot too
214,1,Bad earbuds,Worst earbuds ever scabbed my ears up and made them bleed
215,5,"Here you go, Razer fans!",Good earbuds for Razer fans.
216,5,No issues,Sound is great
217,5,"Read instructions, but work great",Once we got them paired they are great.
218,5,Decent,They are what you expect. Wireless decent sound. Worth only $99
219,5,Good for players,"Very low latency, good for players."
220,4,Decent,"Great product from Razer, they sound better than airpods but there still not the best sounding earbuds. Worth the price"
221,1,Disappointed,It doesnâ€™t sound loud no more. Only the first week of usage. Im returning them.
222,5,Great quality,Like
223,5,Great wireless ear buds,"The headphones have great battery life with the case as a built in battery bank basically, allowing for what feels like endless hours of use. Noise cancelling is about what you could expect from ear buds, would definitely recommend."
224,5,Love this product,"Was skeptical at first. Was deciding between the Apple airpods and this but since I'm using an Android phone and liked the black razer design, I went with this instead. I'm very happy with my purchase!"
225,3,Static when using on PC.,Bought these to use with PC and has nothing but static while paired.
226,4,Easy to use.,"I like how they auto sinc to each other and to the phone, also, the game mode is great, no lag between visuals and the audio. Very impressive. The sound wasn't quite what I was hoping for, but still quite good."
227,5,Nice,Pretty good so far. Sound volume seemed very low at first. Connected to my PC and after that the volume is much higher then out of the box volume with my phone. Comfortable and battery life seems very good.
228,4,Great for the price,"The lid for the charging case could be held on a little better and made of slightly better material but other than that, the quality for what you pay is all there. Sound, work, and look great for the price"
229,5,Itâ€™s ok,Not comfortable to wear in my ear but it was a good price feel cheap tho
230,5,Great Earbuds for Android and iPhone,"Been using these on my iPhone 11 with the TW Hammerhead app and they have been working out quite well for me. Haven't really tried the game mode yet, so I can't comment on it. The battery life have been fantastic and seems to last longer that the 3 hours they advertise. For me, after trying out airpods, they seem to work quite a bit better as I can easily use them with other devices. Overall, I am quite pleased with these buds (and also with the colour choice!)."
231,5,"Fit like Airpods, but with better sound quality","I have Soundcore LIberty Air and Apple's Airpods. These fall in the middle. Let me explain.Airpods were great because of their (near) bullet-proof pairing and easy fit into your ear without blocking out everything. For me, the problem with Airpods is that they don't seal very well and so aren't loud enough in many environments.The Soundcore pair nearly as well and seal very well. That makes them better for loud environments. And the sound quality is notably better, especially the bass. But they have the same virtues/drawbacks of other earbuds that seal in your ear. They can be tricky to get in and they can shut out the environment a little TOO well. Great for planes, not so good on the street.The Hammerhead strikes an interesting medium. They are shaped like the Airpods, making insertion easy. They are slightly larger with ab outer flange that provides just a bit more of a seal than the Airpods without completely shutting out the environment the way the Soundcores do.The Hammerheads are also louder than the Airpods, which is very welcome. And pairing was very easy.A couple of nits. The case is slippery, like the Airpods case. This is a surprisingly big problem with both. I have dropped both and watched the earbuds scatter on dropping more than once. Not great.Second, it is actually hard to open the Hammerhead case. The slim notch is hard to find and smaller than the hinge notch. I can't tell you how many times I've fumbled around trying to open the case, only to fumble the whole thing to the ground due to its slipperiness.That is a real nit though. Currently the balance of good sound quality, easy fitting and solid pairing make these my daily earbuds."
232,4,"Good first revision, needs some tweaks to be perfect","So overall, I really like these earbuds.  I'm just going to point out things that don't come across in the specs.1. The default sound profile is too ""boomy"".  There is a very basic EQ in the app that allows you to boost treble or bass, but boosting the treble then makes the bass too weak.  Razer needs to add finer grained EQ settings.2. The case lid is a bit loose/wobbly.3. The case is very hard to open on the correct side by feel alone.  You'll have to fumble with it, try both sides, or look at it closely to figure out how to open it each time.4. These earbuds are not ""ported"", so they isolate sound more than Airpods do.  I prefer to hear more of the environment, but it's really down to personal preference.5. Battery life reporting behaves very strangely on these earbuds.  On iOS, the earbuds will report 100% battery for 40-50 minutes or so before the battery starts dropping.  And when it does drop, it drops in 10% increments ... AKA it really doesn't update that often.  It's a bit odd and I much prefer how the Airpods report battery, but overall it's not an issue once you know how it works.  I do think the total battery life estimate given by Razer is accurate tho.6. These do not support aptX or aptX LL.  You'd think for gaming earbuds they'd do aptX LL, but nope.7. The right earbud goes on the left side of the case, and the left goes on the right side!  It's also awkward to pick the earbuds out of the case ... they should have added some grooves in the case to make it easier to remove the earbuds as you walk, etc.Now the good news.1.  Gaming mode works on both my iPhone and bluetooth adapters for my Nintendo Switch!  The delay is not perfect, but extremely low compared to most earbuds.  aptX LL probably would have been better, but this is still really good.In gaming mode, the connection will be more prone to breaking up since I assume they are lowering the packet size and decreasing the buffering before playback in the earbuds.  The vast majority of the time, this isn't an issue.  I did see a problem one time when I had the phone in my pocket and was listening to music in gaming mode ... the audio started popping and stuttering.  Switching out of game mode fixed it immediately.2. The touch controls are nice and do more than my Airpods Gen 1 ever did.  Good stuff.  But it takes some time to internalize what all the taps do.Bottom line is ... I like them a lot and I'm going to keep them, as they are a perfect companion to my Switch Lite when I'm out and about.  But there's definitely room for improvement."
