,review rating,review title,review content
28,5,Great Earbuds,"I am really enjoying these earbuds. I use them almost everyday. When I'm running, doing dishes, or at work. These are my favorite earbuds and I'll probably buy another pair I can leave at my desk at work because I hate the days I leave them at home on accident."
29,1,poor sound,"it wasn't the sound i was seeking. too low, not enough bass."
30,4,Decent True Wireless Headphones,"Good Stuff //-Decent battery life-Decent audio quality for music and calls [but don't expect heavy bass, lol]-Lightweight & sweat resistantBad Stuff //-Awkward tactile/button press controls = 'The headphones have an app to help with firmware updates, etc. Inside the app was tutorial for button presses to bring out voice assistant, pause/play track & skip...and I always get the timing wrong. It shouldn't be this clumsy to handle these few options.""-The case is cheaply made = ""I have been careful with it and it already has scratches and smudges. I wish they had opted for a rubberized or a matte look for the case. I would def use the included lanyard, as this little case is easy to misplace.""-Layout of headset case is weird = "" Left side houses the right ear and vice versa..what is wrong with right side with ride headset and vice versa...""Wished it had // [Maybe next version]-Noise Cancellation-Wireless Charging for the case-RGB on the headset and the case for fun/coolness-Small speaker on the case, so you can locate it with Razer app...."
31,2,Could have been great,"I got these in hopes of finding a wireless earbud solution for my Twitch stream so that I would have the option to wear a hat or just not getting headset hair from my Arctis Pro Wireless. I wanted a pair of earbuds that were wireless and low latency so that I could still play games without the massive delay that bluetooth usually comes with. I had hoped that the so called ""Gaming Mode"" on these would do the trick. Sadly I can say it does not. I bought these and another pair of APTX LL earbuds to see if either would work for my needs and then compared the latency of the Razer in both Gaming and non-gaming modes to the APTX LL model as well as a baseline from my Arctis. The APTX LL earbuds were only 22ms slower than my Arctis which wasn't too bad honestly but then the Razer IN ""Gaming Mode"" were 82ms slower than my Arctis! Even if the latency had been acceptable the 4 hour max battery life is just too short for most streams anyway so all-in-all these are a big no for me."
32,5,Best Bluetooth headphones Iâ€™ve ever owned!,"When I saw these headphones be unveiled by Razer I immediately knew I wanted them. Finally purchased as a birthday present. I have to admit I was going off the brand name when I bought them and didnâ€™t take the time to read reviews beforehand. I read many reviews in each rating bracket and was still confident that I made a good purchase.Design: these have a similar design to AirPods or any Apple headphone which I like because they fit inside my ears the best. My wife has some Skull Candy headphones that I have to push deep into my ears and I do not enjoy that. I will say the touch controls on the outside of the headphones are a little too sensitive. Iâ€™ve paused or restarted what Iâ€™m listening to because I put my finger on the touch control when removing the headphones.Battery: Iâ€™ve seen a 4 hour range from a few people and thatâ€™s about what I got out of them before I charged them for the first time.Sound: I saw MANY reviews saying these headphones werenâ€™t loud enough for them. THESE ARE NOT NOISE CANCELING HEADPHONES!! Iâ€™m a mechanic and work in a loud shop so my hearing isnâ€™t the best, but I canâ€™t have the sound up more then 1/2 way up. Itâ€™s just too loud for me. You can download the app for these headphones and adjust the sound on there. The sound quality is outstanding as well. I havenâ€™t tried the gaming mode as I donâ€™t play too many video games anymore. There is also no 1 second lag between video and sound when you watch a video on YouTube or Disney+. Itâ€™s crisp and clear.Bluetooth: easy to set up with an iPhone. I also saw many reviews saying the headphones would disconnect or cut in and out of their phone was in their pocket. Iâ€™ve had zero problems with that. I left my phone in my room and walked to the other side of my house and they were still connected. So the range is very good, the app says the range is good for 10 meters or about 30 feet. Iâ€™d say that is correct.Overall I am very happy and satisfied with this purchase! $99 is a great price for this product. Iâ€™d gladly buy them again."
33,3,Excellent sound without blocking you off from the world! Slight problem of multi-device support.,"Update to my original review:The inability to connect to multiple devices (phone, tablet, etc)  and seemlessly switch back and forth between them has proven to be quite a nuisance. Thes are great earbuds for sure, but if you are like me, and are constantly using multiple devices for work or otherwise, that is the one thing that might hold you back.Original Review:I have tried a number of solutions recently including Samsung Galaxy Buds, Anker Soundcore Liberty Air 2, Airpods (I had those for about a year). I personally like the form factor of Airpods, because of the ease of putting them in your ears and back in the case. The stem makes them easy to handle. I also think the stem design seems better for calls, getting the mic just a bit closer to your mouth. I also like earbuds without a silicone tip going in your ear. I realize the Airpods Pro might have resolved the vacuum effect, but literally all other earbuds that use a silicone tip make the vacuum effect happen. I know some like that for cutting out ambient noise, but I find it uncomfortable. I like hearing at leas a little bit of what's around me, and not feeling like my ears are plugged up. The Razer Hammerhead earbuds, in my opinion, offer the best of both worlds: easy to put in your ears quickly, and then back in the case (though the case lid is sometimes difficult to open with short nails), but great sound without plugging up your ears!The fit is also nice. I know this is a personal thing, but if you like how the original Airpods fit, then ad to that the fact that these earbuds also come with a silicone sleeve which can help fit bigger ears. I use the sleeve and find it comfortable but snug (the original Airpods did move around a bit for me, but weren't too bad).They connect VERY QUICKLY! As soon as you open the lid, they are already connecting, and I usually heare the ""connected"" notification before I actually have one of the buds in my ear!I rated ""Noise cancellation"" 4 stars in this review, because they don't have active cancellation, which I don't care about, but they do get super loud! I'm listening to most things at about 50% volume comfortably, whereas my Airpods were always jacked to 100% and still not as loud as 50% on these earbuds. Bass is good and everything is clear. I suggest using your phone's EQ setting rather than the Razer app. I know Samsung has great EQ settings now including a ""Custom"" option.Improvement suggestions: I'd like the option to change tap functionality. It's already great, but I'd like to be able to change it to my liking, and also allow for volume control. Also, I'd like to see quicker switching from one device to another. You currently need to turn off bluetooth on the currently connected device to switch to another. on Android I do that and then us a phenomenal app called ""Bluetooth Audio Device Widget - Connect, Volume"" to force connection on the other device. You can use it as a widget or even have a Quick Panel Tile for the same functionality. It's great!"
34,2,Headache Inducing Earphones,"I really wanted to like these. It was a great price and I've always been a fan of Razer products, but I absolutely could not get these to work.Pairing was fine and sound quality is pretty good. However, the controls on these things have a mind of their own. Play/pause on 1 tap almost never worked. Since the first try didn't work, I would try again but then this registered as 2 taps which skipped the song. Sometimes, even that didn't work and it would register as 3 taps, which would replay/go back! When I took 1 earphone out, touching the sides would trigger it to play/pause and I could not find the same spot that triggered it. It was just completely random.The issues were just way too much for me to ignore. I'm definitely returning these."
35,5,What I was looking for!,"As an Android and Chromebook user, I've been wanting an airpod like headset for some time. I've tried airpods as well as a couple like them (ticpods, soundcore, soundpeats), but they don't quite work as they should with my devices. The sound quality of the Hammerhead is much better than airpods, and the fit is about the same. I appreciate the silicone tips, which keep them seated in my ears while riding my bike. I use them for both my Pixel 3 and Pixelbook Go. The only downside is that the case's cover could be better. I've found that battery life is much longer than 3 hours. I've listened to music for much of the day at times, and never ran out of battery."
36,3,Good but not great.,"They're a good value for the price with some big downsides. If those dont bother you too much then they're fine.Pros:- Loud and clear until turned up all the way. Lots of bass. I usually keep them on the lowest volume level at work or when running.- Gaming mode works. It reduces latency by a large amount. It's not good enough for competitive gaming though. Casual is fine.Cons:- Battery life is bad compared to other earbuds in 2020. Gaming mode cuts it down to <3 hours. Normal mode gets between 3 and 5.- Connection is weak. It will cut out occasionally if left in my pants pocket.- Case feels flimsy- Equalizer app is mediocre. Bass mode makes them sound muddy. Treble mode makes them sound like they're playing through a pringles can.- Included silicon covers fall off easily after a few weeks. I lost one after a month.- Wrist strap is too small unless you're a 12 year old girl.- Touch controls are bad. They are very finicky to the point I try to avoid touching them except to activate gaming mode.- Default AAC codec.Things to consider:- There is no noise isolation. This isn't a pro or con depending on your needs and expectations.- The fit is almost the exact same as airpods. If those work well for you, these will too.These are decent earbuds if you listen to music or play games for short bursts. Do not expect long session from them. They work surprisingly well for workouts as long as you dont keep the phone in your pocket."
37,3,Not the AirPods Replacement I Hoped For...,"I recently switched from iOS to Android so I had to pick up a set of wireless earbuds that charge via USB C to replace my AirPods.The sound quality is outstanding. Way better than the Gen 1 AirPods. Seriously, they sound crazy good.The battery life kind of sucks, but I don't use them for super long periods of time so I don't really run into issues very often.I had high hopes for these, but they simply do not compare to the fit and finish of the AirPods. They aren't as comfortable or as well built. The case is kind of janky (when compared to AirPods) and the lid can pop open sending your buddy flying if you use the lanyard.I will be trying the upcoming Pixel Buds to see if those are a better fit for me."
38,5,"Everything you expect from a Razer product, and more.","The last earbuds I'll probably ever buy. They don't have the low end power I'd like but they have everything else. And they fit any ear. My left one keeps trying to fall out but that's my ears fault. Seemless pairing, no latency that I've noticed, never drop out, battery life is awesome and the charge case (though I'm convinced it was made backwards) charges quickly and charges the headphones quickly. All in all, everything and more that I expect from a Razer product. Honestly, only bought it through Amazon because I wanted them now. My phone's bought from the Razer website took almost 3 weeks. My earbuds were at my door in 2 days. Amazon, doing a good job. And Razer, keep up the good work."
39,3,65ms NOT GOOD ENOUGH!,"To be advertised as a gaming headset...  ...it better perform.  These DO NOT!!!Does it have less lag? Yes.  Is it good enough for PUBG mobile or COD?  NOOOOOOO!!!!!Until Qualcomm brings back Low Latency codec to Aptx, and then supports that in mobile devices, pleas le do not waste your time with wireless headphones.Curse Apple for starting the whole ""cut out the 3.5 jack"" campaign.  But curse Android markets even more for following suit and not listening to their customers.Rant over.lolSeriously, if you play some sort of RPG mobile game, you don't really need low latency anyways.  If you play FPS games, these will not be enough.Also, comfort.  For my ears, these were terrible.  Worst earbuds I've ever used. Sound volume sucked, base was abnormally muddy.These headphones are terrible even if they were $20, but  #&@+_;""+!,  they're FREAKING $100!!!No thanks."
40,4,Definetly with it,Just got started I'm very impressed with the product always am a fan of razer.ProsSound is quite wellGame-mode alternativeCase has a magnet for the cover and the earbuds. Plus comes with a lanyard.USB is nylon and has dust coversConsOnly one silicone earbud no extras with wing tipsCant control volume with earbuds only volume control with your phone or ext.Other then that very nice product.
41,4,They are on,Some times you have to disconnect and reconnect because the signal starts fading don't know if it's the phone or the earbudsBoth brand new razer phone 2 and hammerhead bought at the same time
42,2,Terrible bluetooth,At first i was so excited to get these thinking I could replace the airpods with these but they are so inconsistent! They cut off all the time for no reason ill put my phone in my pocket while listening to music and they cut in and out over and over again. They feel nice and sound good but thats only when they actually connect.
43,4,Good sound when they have a connection,"Easy to use and good sound when the connection doesn't fade out. It seems to happen when I'm outdoors and the Bluetooth signal can't bounce around to the earbuds. Even with my phone in my front pocket and in my hand while hiking/running, the signal fades out then returns when my hand is in front of me. Other than that they are great earbuds if yours going to be indoors and stationary when outdoors."
44,5,Really good Razer Earbuds!,"Best earbuds I've ever used, people complain about the battery life, but I personally never use them for more than 1-1/2 hour at a time so its great, the sound quality is really good, but not to the level of my Status Audio CB-1 that I got for $40 cheaper, but the convenience, comfort, & SUPER ease of use makes this an excellent set of earbuds for me"
45,2,"Short life, short Bluetooth range","The right ear bud just plain doesn't work while my phone is in my pocket anymore. I've had the earbuds for about a month now and about a week ago they worked great! No issues whatsoever. Now, all of a sudden, the right ear bud has a super low Bluetooth range. I've tried plugging everything in to make sure it wasn't the battery being low, but now that they're fully charged, it's the same issue. I can't walk around with my phone in my pocket and listen to music through both earbuds anymore. Pretty disappointing."
46,5,ðŸ‘ðŸ»ðŸ‘ðŸ»,"I found them to be more comfortable than I thought they would be, very light weight which helps. I saw people complain about them being cheap feeling, I didn't see this, but the weight almost makes you want to think this."
47,5,Same razer quality,"Update 1/1/2020 Firmware update + companion app with EQ presets are amazing. No joke with treble boost feels like i am cheating i can hear like i have comtacs on.I bought the original wired hammer heads and still have them, but decided to go wireless. Best choice by far the only problem i have is the battery life. From my experience so far after a hour work out and low latency use for about two to three hours of gaming has me in the yellow which is only half charge so it's not bad at all."
48,3,Disappointed!! ðŸ˜•,"Razer you made me disappointed. Mediocre sound, I expected more from you. But unfortunately it was not so. I'm not one of the people who make bad comments, but $ 99 must have been worth it."
49,4,Good but could be better.,"I couldn't wait to get my hands on this one, and now I finally do. The first week I'm using this one for listening to music and gaming, it was fine. The sound quality is good tho it doesn't have noise cancellation. Battery life is awesome. But the one thing I'd say on this one is that it hurts my ears. Am I putting it on wrong? Does anyone have the same experience as well?"
50,5,"A solid, functional wireless earbud","I'm coming from using first-gen AirPods so I have limited experience with these types of products.These feel and sound amazing. I tried using Amazon Echo Buds but had to gift them to my wife, as the inner-ear style just doesn't work well for me.These feel like the traditional AirPods style in the ear. Obviously some people like that and others do not but I prefer them.Pairing is easy, as you just tap and hold into pairing mode. You can also pair them while they're in the case.I tested gaming mode both on my laptop and on my mobile device (Android) and it worked flawlessly. No issues with desynced audio or any type of distortion. To activate gaming mode, you tap three times and hold on the third. You do the same to disengage it.I'm impressed with the case. It's quite different than what the AirPods use. Has a charging light indicator. I REALLY like how it's a USB-C port. One thing that's included is a strap that attaches to the side... it's not something I thought I wanted in a carrying / charging case until I have it.Haven't had enough time to really get into battery. I know based on specs it's a bit lower than some competing products... time will tell through every day use. Will update this review based on usage.There you have it! Solid, functional wireless earbuds in an AirPods style that costs a fair amount less. Five stars for now!"
51,1,Awful Bluetooth connection,"As some one who almost solely uses Razer products I had high hopes for these and was so excited to get them. I had the hammerhead BT and love those but these are just not up to par at all. I could never have a consistent connection. As soon as I put my phone in my pocket, they would cut in and out every second."
52,5,Gaming Mode Works,"These are now my main headphones that I will carry on me daily. I also own Jabra 65t Elite. I almost didn't buy these because on paper the 65t should be superior but me being a big fan or Razer, I just had to try these. I'll let others talk about audio quality since I'm not an audiophile and music playback is good enough for me. I want to share a specific use case of mineThe game mode works. I paired it with the HomeSpot Bluetooth adapter for Nintendo Switch and with game mode disabled, it has the same lag that I get with the Jabra 65t Elite. Turning on game mode, it is pretty much lag free. Don't know how they did it because the HomeSpot adapter says it is connected with SBC codec (which has the most delay compared to aptX and aptX-LL). Played Overwatch and it was like I had wired headphones plugged in. I don't own an aptX headset so can't compare with that.I also took an unexpected phone call while using these at the grocery store this weekend. The person on the other line didn't complain about not hearing me or background noise. I actually get the opposite experience with my Jabra 65t Elite so I stopped using them for phone calls. I don't intend to use these as a main headset to take calls, but it is nice knowing that I could. (if it means anything, I use the OG Razer Phone)Also wanted to add that charging via USB-C is another reason the Jabra 65t is getting replaced as my daily one. I can finally stop carrying a micro-usb cord with me.The only ""weird"" thing I can think of is how you put the right ear piece in the left side of the carrying case and the left ear piece in the right side. It was weird to me at first, but I can see why they did it. Thinking if it was done the ""correct"" way with the same orientation, If you imagine holding the carrying case with your left hand to grab the right ear piece, you'd have to flip the ear piece in your fingers/hand before inserting into right ear. With how it is now, you don't have to do thatThe 65t will still have its uses for me. Because of its in-ear design, I'll keep using it for the superior noise cancellation when I want it (like when during work outside of the house and working out at the gym)"
53,5,Solid deal,"I always liked the sound profile from Razer after their first gen Kraken headphones. They didnâ€™t claim the battery life of the earbuds themselves and I watched one review saying itâ€™s 3 hours, from my testing itâ€™s longer than 3, not too sure how long longer than 3 since I donâ€™t wear them for that long every session. The lag is definitely really low, fit is great too. The biggest for these are probably the position of the microphones. Also theyâ€™re omnidirectional and no mentioning of noise cancelling, it basically picks up your voice and everyone elseâ€™s. I really like the case design though I wish they used their flagship CNC aluminum :p"
54,3,I really wanted to love these,"Let me start off by saying I'm a huge Razer fan. I was excited to get these as soon as they were available. All until i pulled the earbuds out of the box. The earbuds and case feel like cheap plastic. The plastic isn't seamless. The touch function doesn't always register the first. Usually takes a few tries. No premium feel at all which is disappointing. Not worth the $99 price tag. The sounds is actually pretty good. Plenty of bass. I'll hold onto them for a little while longer, but will most likely be returning them."
55,5,Very satisfied so far!,"Everything I expected and not a single issue so far. They paired quick and easy; I had zero hassel. Touch controls work exactly per instructions. The sound is great. The range is great. I feel immersed watching videos on my phone. I tested streaming video and music and I didn't notice any lag. I haven't tested games or the game mode function or battery life yet. But, I've been very pleased with them right out of the box."
56,3,Not bad but not great.,"The case holds the right ear bud on the left side and the left on the right, really???  What smart engineer came up with that one, and how did it get through design???  Overall they look good, comfortable, but sound mediocre."
57,5,Incredible so far!,"So far so good! Been using them for a little over an hour, I compare them to my AirPods and I honestly like these better. They fee a lot lighter and I like all the gestures that come with it too, on top of that they sound incredible!! The bass in it is awesome. Sounds just like my other razer headphones. Quick to connect and easy to use app."
58,1,was excited till i used them....,"The sound is an improvement over the older hammerhead BT headphones but... The touch controls are tough to use. I mean it took me serval tries to get this into gaming mode or to even pause. Its like the buds would get confused and would turn off while tring to pause. maybe I am just not used to such controls. This is just my experience thus far. Then there is the connections. On my phone the razer phone 2. the connections is solid while my phone is out say on a table or right in front of my while playing a game. Once my phone goes into  my pocket (pants pocket, jacket chest pocket, or even my backpack) the buds will have trouble keeping connection making listening to anything choppy. This same choppy connection I do experience while on my 2019 razer blade stealth... while its right in front of my. Now I own other Bluetooth headphones. Bose sound sport. the older hammerhead bt and an even older razer BT headphones (sorry I forget the name) and NONE of those have had any choppy connection problems like these buds."
